<?xml version="1.0" encoding="UTF-8"?>
<quest_scripts xmlns:xsi="http://www.w3.org/2001/XMLSchema-instance" xsi:noNamespaceSchemaLocation="quest_script_data.xsd">
<!--
	The Shugo Emperor's Vault
	Make By Encom
 -->
	<!-- [Event/Daily] Kill Kinah Grabbers -->
	<monster_hunt id="80690" start_npc_ids="832923" end_npc_ids="832922">
		<monster var="0" npc_ids="235678" end_var="1"/>
		<monster var="1" npc_ids="235634" end_var="1"/>
	</monster_hunt>
	<!-- [Event] Mirez, The Mired -->
	<monster_hunt id="80692" start_npc_ids="832921">
		<monster var="0" npc_ids="235640" end_var="1"/>
	</monster_hunt>
	<!-- [Event] Zodica, The Crazed -->
	<monster_hunt id="80693" start_npc_ids="832921">
		<monster var="0" npc_ids="235685" end_var="1"/>
	</monster_hunt>
	<!-- [Event] Budyn, The Bloodied -->
	<monster_hunt id="80694" start_npc_ids="832921">
		<monster var="0" npc_ids="235684" end_var="1"/>
	</monster_hunt>
	<!-- [Event] Rupasha, The Rapacious -->
	<monster_hunt id="80695" start_npc_ids="832921">
		<monster var="0" npc_ids="235683" end_var="1"/>
	</monster_hunt>
	<!-- [Event] Gradi, The Grusome -->
	<monster_hunt id="80696" start_npc_ids="832921">
		<monster var="0" npc_ids="235647" end_var="1"/>
	</monster_hunt>
</quest_scripts>